{
  "project_version": "0.5.0",
  "execution_profile": "chemotaxis-spatial-v1",
  "random_seed": 42,
  "id": "chemotaxis-lifecycle",
  "domain": {
    "geometry": "thin_layer",
    "counts_xyz": [
      20,
      10,
      1
    ],
    "spacing_um_xyz": [
      10.0,
      10.0,
      2.0
    ]
  },
  "groups": {
    "cells": {
      "ids": [
        "cell-000",
        "cell-001",
        "cell-002",
        "cell-003",
        "cell-004",
        "cell-005",
        "cell-006",
        "cell-007"
      ],
      "positions_um": [
        [
          60.0,
          15.0,
          1.0
        ],
        [
          60.0,
          25.0,
          1.0
        ],
        [
          60.0,
          35.0,
          1.0
        ],
        [
          79.0,
          45.0,
          1.0
        ],
        [
          60.0,
          55.0,
          1.0
        ],
        [
          60.0,
          65.0,
          1.0
        ],
        [
          60.0,
          75.0,
          1.0
        ],
        [
          60.0,
          85.0,
          1.0
        ]
      ],
      "orientation_xyzw": [
        [
          0.0,
          0.0,
          0.0,
          1.0
        ],
        [
          0.0,
          0.0,
          0.3826834323650898,
          0.9238795325112867
        ],
        [
          0.0,
          0.0,
          0.7071067811865476,
          0.7071067811865476
        ],
        [
          0.0,
          0.0,
          0.9238795325112867,
          0.38268343236508984
        ],
        [
          0.0,
          0.0,
          1.0,
          6.123233995736766e-17
        ],
        [
          0.0,
          0.0,
          0.9238795325112867,
          -0.3826834323650897
        ],
        [
          0.0,
          0.0,
          0.7071067811865476,
          -0.7071067811865475
        ],
        [
          0.0,
          0.0,
          0.3826834323650899,
          -0.9238795325112867
        ]
      ],
      "initial_geometry": [
        {
          "shape": "capsule",
          "length_um": 2.0,
          "diameter_um": 0.8,
          "provenance": {
            "kind": "example",
            "reference": "N3 constructed numerical demonstration; docs/science/n3-mechanisms.md; not experimentally calibrated"
          }
        },
        {
          "shape": "capsule",
          "length_um": 2.0,
          "diameter_um": 0.8,
          "provenance": {
            "kind": "example",
            "reference": "N3 constructed numerical demonstration; docs/science/n3-mechanisms.md; not experimentally calibrated"
          }
        },
        {
          "shape": "capsule",
          "length_um": 2.0,
          "diameter_um": 0.8,
          "provenance": {
            "kind": "example",
            "reference": "N3 constructed numerical demonstration; docs/science/n3-mechanisms.md; not experimentally calibrated"
          }
        },
        {
          "shape": "capsule",
          "length_um": 2.0,
          "diameter_um": 0.8,
          "provenance": {
            "kind": "example",
            "reference": "N3 constructed numerical demonstration; docs/science/n3-mechanisms.md; not experimentally calibrated"
          }
        },
        {
          "shape": "capsule",
          "length_um": 2.0,
          "diameter_um": 0.8,
          "provenance": {
            "kind": "example",
            "reference": "N3 constructed numerical demonstration; docs/science/n3-mechanisms.md; not experimentally calibrated"
          }
        },
        {
          "shape": "capsule",
          "length_um": 2.0,
          "diameter_um": 0.8,
          "provenance": {
            "kind": "example",
            "reference": "N3 constructed numerical demonstration; docs/science/n3-mechanisms.md; not experimentally calibrated"
          }
        },
        {
          "shape": "capsule",
          "length_um": 2.0,
          "diameter_um": 0.8,
          "provenance": {
            "kind": "example",
            "reference": "N3 constructed numerical demonstration; docs/science/n3-mechanisms.md; not experimentally calibrated"
          }
        },
        {
          "shape": "capsule",
          "length_um": 2.0,
          "diameter_um": 0.8,
          "provenance": {
            "kind": "example",
            "reference": "N3 constructed numerical demonstration; docs/science/n3-mechanisms.md; not experimentally calibrated"
          }
        }
      ]
    }
  },
  "species": {
    "nutrient": {
      "concentration_unit": "uM",
      "initial_concentration": {
        "value": 1.0,
        "unit": "uM",
        "provenance": {
          "kind": "example",
          "reference": "N3 constructed numerical demonstration; docs/science/n3-mechanisms.md; not experimentally calibrated"
        }
      }
    }
  },
  "controls": {},
  "graph": {
    "protocol_version": "0.1.0",
    "id": "chemotaxis-lifecycle-graph",
    "nodes": [
      {
        "id": "nutrient_field",
        "module_id": "field.diffusive_local",
        "module_version": "2.0.0",
        "owner": {
          "kind": "environment",
          "id": "nutrient_field"
        },
        "parameters": {
          "species": {
            "value": "nutrient",
            "provenance": {
              "kind": "example",
              "reference": "N3 constructed numerical demonstration; docs/science/n3-mechanisms.md; not experimentally calibrated"
            }
          },
          "diffusivity_um2_s": {
            "value": 1.0,
            "unit": "um^2/s",
            "provenance": {
              "kind": "example",
              "reference": "N3 constructed numerical demonstration; docs/science/n3-mechanisms.md; not experimentally calibrated"
            }
          },
          "gradient_x_um_per_um": {
            "value": 0.008,
            "unit": "uM/um",
            "provenance": {
              "kind": "example",
              "reference": "N3 constructed numerical demonstration; docs/science/n3-mechanisms.md; not experimentally calibrated"
            }
          },
          "gradient_y_um_per_um": {
            "value": 0.0,
            "unit": "uM/um",
            "provenance": {
              "kind": "example",
              "reference": "N3 constructed numerical demonstration; docs/science/n3-mechanisms.md; not experimentally calibrated"
            }
          },
          "gradient_z_um_per_um": {
            "value": 0.0,
            "unit": "uM/um",
            "provenance": {
              "kind": "example",
              "reference": "N3 constructed numerical demonstration; docs/science/n3-mechanisms.md; not experimentally calibrated"
            }
          }
        }
      },
      {
        "id": "cell_area",
        "module_id": "pts.capsule_area",
        "module_version": "1.0.0",
        "owner": {
          "kind": "population",
          "id": "cells"
        },
        "parameters": {}
      },
      {
        "id": "capacity",
        "module_id": "pts.capacity_simplified",
        "module_version": "1.0.0",
        "owner": {
          "kind": "population",
          "id": "cells"
        },
        "parameters": {
          "g_requested": {
            "value": 2.0,
            "unit": "1",
            "provenance": {
              "kind": "example",
              "reference": "N3 constructed numerical demonstration; docs/science/n3-mechanisms.md; not experimentally calibrated"
            }
          },
          "reference_pts_copies": {
            "value": 100.0,
            "unit": "molecule",
            "provenance": {
              "kind": "example",
              "reference": "N3 constructed numerical demonstration; docs/science/n3-mechanisms.md; not experimentally calibrated"
            }
          },
          "g_cap": {
            "value": 3.0,
            "unit": "1",
            "provenance": {
              "kind": "example",
              "reference": "N3 constructed numerical demonstration; docs/science/n3-mechanisms.md; not experimentally calibrated"
            }
          },
          "reference_area_um2": {
            "value": 5.0,
            "unit": "um^2",
            "provenance": {
              "kind": "example",
              "reference": "N3 constructed numerical demonstration; docs/science/n3-mechanisms.md; not experimentally calibrated"
            }
          }
        }
      },
      {
        "id": "nutrient_sample",
        "module_id": "field.sample_local",
        "module_version": "1.0.0",
        "owner": {
          "kind": "population",
          "id": "cells"
        },
        "parameters": {
          "species": {
            "value": "nutrient",
            "provenance": {
              "kind": "example",
              "reference": "N3 constructed numerical demonstration; docs/science/n3-mechanisms.md; not experimentally calibrated"
            }
          }
        }
      },
      {
        "id": "uptake_request",
        "module_id": "uptake.pts_request",
        "module_version": "1.0.0",
        "owner": {
          "kind": "population",
          "id": "cells"
        },
        "parameters": {
          "species": {
            "value": "nutrient",
            "provenance": {
              "kind": "example",
              "reference": "N3 constructed numerical demonstration; docs/science/n3-mechanisms.md; not experimentally calibrated"
            }
          },
          "turnover_s": {
            "value": 2.0,
            "unit": "1/s",
            "provenance": {
              "kind": "example",
              "reference": "N3 constructed numerical demonstration; docs/science/n3-mechanisms.md; not experimentally calibrated"
            }
          },
          "half_saturation_um": {
            "value": 1.0,
            "unit": "uM",
            "provenance": {
              "kind": "example",
              "reference": "N3 constructed numerical demonstration; docs/science/n3-mechanisms.md; not experimentally calibrated"
            }
          }